{"_license":{"classification":"machine_readable_prepublication_return_receipt","copyright":"Copyright 2026 Ingolf Lohmann","license":"CC-BY-NC-ND-4.0","license_text_ref":"LICENSES/CC-BY-NC-ND-4.0.txt","rights_holder":"Ingolf Lohmann"},"candidate_files":[{"bytes":18120,"git_blob_sha1":"e1ed265239aa5e1436055279069c7e21525a13fe","path":"docs/publications/2026-08-07-universum-als-round-trip/DAS_UNIVERSUM_ALS_ROUND_TRIP_DE.md","sha256":"dc58e50161b22826152dd251db836f06f85235a470e0253aeefa1b0a380787fe"},{"bytes":5150,"git_blob_sha1":"cc13b5530051ea7b7fe0eceae5558cd93f44611d","path":"docs/publications/2026-08-07-universum-als-round-trip/ROUND_TRIP_PROMOTED_FORMAL_RESULTS_V1.md","sha256":"e5fd9c53a0bf6c84471d9b26d0c3c06019977aa6b2367913006fa9560a3c948f"}],"change_notice_path":null,"change_reasons":[],"changed_claim_ids":[],"content_changed":false,"original_files":[],"publication_id":"qikvrt-round-trip-canonical-publication-v1","return":{"candidate_returned_to_owner":true,"owner_name":"Ingolf Lohmann","owner_type":"NATURAL_PERSON","return_channel":"GitHub PR #524 conversation comment 5221937568","returned_at":"2026-08-07T20:59:00Z","visible_change_notice_returned":false},"schema":"qikvrt_prepublication_return_receipt_v2"}
