{
  "_license": {
    "classification": "machine_readable_prepublication_return_receipt",
    "copyright": "Copyright 2026 Ingolf Lohmann",
    "license": "CC-BY-NC-ND-4.0",
    "license_text_ref": "LICENSES/CC-BY-NC-ND-4.0.txt",
    "rights_holder": "Ingolf Lohmann"
  },
  "candidate_files": [
    {
      "bytes": 3259,
      "git_blob_sha1": "09f7c911687b528c60c3659d30367729e48f55ce",
      "path": "release/bootstrap-runtime-bc2da76a-20261005/README.md",
      "sha256": "96bbd0427443778290ee17166cef15a6252fbd500115d29c959f4b3f31f80136"
    },
    {
      "bytes": 4194304,
      "git_blob_sha1": "504d1fc8e1e620e50f348187305be330e31fa515",
      "path": "release/bootstrap-runtime-bc2da76a-20261005/QIKVRT_Bootstrap_Runtime_bc2da76a.zip.part000",
      "sha256": "2452d0ac5b9209d57b2d36470b9fd3f8942426088000eafaa2219dfd97682754"
    },
    {
      "bytes": 4194304,
      "git_blob_sha1": "723c1c7a6a4b488950b89ea5733d2547e6e294c8",
      "path": "release/bootstrap-runtime-bc2da76a-20261005/QIKVRT_Bootstrap_Runtime_bc2da76a.zip.part001",
      "sha256": "06c05c7620159d3bfc8e44e73bc139c9edd90d964e44ba9f7c29479e98c585db"
    },
    {
      "bytes": 4194304,
      "git_blob_sha1": "5a69c2324aff4320099849ebb5b369cda991e57a",
      "path": "release/bootstrap-runtime-bc2da76a-20261005/QIKVRT_Bootstrap_Runtime_bc2da76a.zip.part002",
      "sha256": "c683669cdd9f76190f1432b7e8e177c1ecc45617de22a683e00177d937c84fc9"
    },
    {
      "bytes": 4194304,
      "git_blob_sha1": "17b20952c9bbfadd088221e70e4fcd7acecffbb3",
      "path": "release/bootstrap-runtime-bc2da76a-20261005/QIKVRT_Bootstrap_Runtime_bc2da76a.zip.part003",
      "sha256": "e5722d429e88318d26319db96ff023af59870d89c5b036b6196237684cc2230f"
    },
    {
      "bytes": 4194304,
      "git_blob_sha1": "27209624656dcc7dba4813e93b8868ca87579999",
      "path": "release/bootstrap-runtime-bc2da76a-20261005/QIKVRT_Bootstrap_Runtime_bc2da76a.zip.part004",
      "sha256": "1995da763d6411bd6e6af6e984c2a02baf3c71c9d168a61daecc80519b3cb13c"
    },
    {
      "bytes": 4194304,
      "git_blob_sha1": "e86f6f64f9c24efc9e9063bc3303c75b906fbac0",
      "path": "release/bootstrap-runtime-bc2da76a-20261005/QIKVRT_Bootstrap_Runtime_bc2da76a.zip.part005",
      "sha256": "dc6316f21c020224b856881c6c2f29e3f789e5913d8165eb49a072177551b678"
    },
    {
      "bytes": 4194304,
      "git_blob_sha1": "4dddc8ccbac6ea1857ad469f39a1448d1672fdbd",
      "path": "release/bootstrap-runtime-bc2da76a-20261005/QIKVRT_Bootstrap_Runtime_bc2da76a.zip.part006",
      "sha256": "38ad2a6ec86fcf6b057b79c075fac4b4ceaa07da963015cbbf10f490e9a61c6f"
    },
    {
      "bytes": 4194304,
      "git_blob_sha1": "c9c1d4ee7f53484c1ed886dafd91cc78e3fd571a",
      "path": "release/bootstrap-runtime-bc2da76a-20261005/QIKVRT_Bootstrap_Runtime_bc2da76a.zip.part007",
      "sha256": "8161cf1f6c988d03775bf8ddc381b6d2c3ea8dda6cfce3ea8cb06a55c5a0a57e"
    },
    {
      "bytes": 4194304,
      "git_blob_sha1": "e976502aca64d963ace4b58d59901991bcc21652",
      "path": "release/bootstrap-runtime-bc2da76a-20261005/QIKVRT_Bootstrap_Runtime_bc2da76a.zip.part008",
      "sha256": "530baa503f04dd49843f441161ff323348b10bc1852e7dde6980882ec412a06b"
    },
    {
      "bytes": 4194304,
      "git_blob_sha1": "9dea68d37ffcb26e19a521661862966a715a5aac",
      "path": "release/bootstrap-runtime-bc2da76a-20261005/QIKVRT_Bootstrap_Runtime_bc2da76a.zip.part009",
      "sha256": "d2e843d92766339f66ac96eba1b1fe83f5fb6a4425716d6d553d905225f45da3"
    },
    {
      "bytes": 4194304,
      "git_blob_sha1": "7db0bb6ce1aafa84b748e71059631da60ec8796c",
      "path": "release/bootstrap-runtime-bc2da76a-20261005/QIKVRT_Bootstrap_Runtime_bc2da76a.zip.part010",
      "sha256": "95d587d227e56b106b17ead152eb8387c4c921c7464a2e68a67ff1d23d61f7b2"
    },
    {
      "bytes": 4194304,
      "git_blob_sha1": "8b2cc32f5a6ad77bdd04d157c6ffd9fe7b84ea9f",
      "path": "release/bootstrap-runtime-bc2da76a-20261005/QIKVRT_Bootstrap_Runtime_bc2da76a.zip.part011",
      "sha256": "f8f95c40c31c10cb32839482cc1e641caecfccd541d452429b119468140485c5"
    },
    {
      "bytes": 4194304,
      "git_blob_sha1": "0dcd2ba0ebf069beb67e0863b12e21609ba59dd3",
      "path": "release/bootstrap-runtime-bc2da76a-20261005/QIKVRT_Bootstrap_Runtime_bc2da76a.zip.part012",
      "sha256": "7d4abe5076bad55747927a57e0c0f83d502bf464a5ae5c2960d87c4464a3815d"
    },
    {
      "bytes": 4194304,
      "git_blob_sha1": "431c04c3de18ca4554c842e0b967033119889a12",
      "path": "release/bootstrap-runtime-bc2da76a-20261005/QIKVRT_Bootstrap_Runtime_bc2da76a.zip.part013",
      "sha256": "394bb3e395d2054c7a878d3e1cf28e42db37c5e022e53ba21737e950a6d562ab"
    },
    {
      "bytes": 4194304,
      "git_blob_sha1": "f3b3bb7ba3daadb6e72fd0fd389715141189a198",
      "path": "release/bootstrap-runtime-bc2da76a-20261005/QIKVRT_Bootstrap_Runtime_bc2da76a.zip.part014",
      "sha256": "42624d8ae411ab4e8cea580baa854c4e6ff3d917019beb984f042018b5ff43e0"
    },
    {
      "bytes": 4194304,
      "git_blob_sha1": "8c3e5667d4144097cbcd94e8cea00268b385619d",
      "path": "release/bootstrap-runtime-bc2da76a-20261005/QIKVRT_Bootstrap_Runtime_bc2da76a.zip.part015",
      "sha256": "383daf3f8382a3dba25e206446798feec3fa8a437b4fc4a3e2c50c74092fcd55"
    },
    {
      "bytes": 4194304,
      "git_blob_sha1": "bfaa3431eac1af3534012edc678cf08d92839c1d",
      "path": "release/bootstrap-runtime-bc2da76a-20261005/QIKVRT_Bootstrap_Runtime_bc2da76a.zip.part016",
      "sha256": "3ba73afc4087352803634197d1cd261af939a61da6d1280ab9a35c1622455f4b"
    },
    {
      "bytes": 4194304,
      "git_blob_sha1": "3d9f3d0819c05a03b6115e4d0ffe270903e8d890",
      "path": "release/bootstrap-runtime-bc2da76a-20261005/QIKVRT_Bootstrap_Runtime_bc2da76a.zip.part017",
      "sha256": "76e0b84cead4525712a40094767e738cc1e3b17e01ca608af79fd86f0a0bcbad"
    },
    {
      "bytes": 4194304,
      "git_blob_sha1": "51711711dbdcb4f715a7526381ef168d1ed8983e",
      "path": "release/bootstrap-runtime-bc2da76a-20261005/QIKVRT_Bootstrap_Runtime_bc2da76a.zip.part018",
      "sha256": "00cc6d1b89b560e76ef6b9fc4999907044843d5e8b6d3cb4f2aff58b2ddde791"
    },
    {
      "bytes": 4194304,
      "git_blob_sha1": "262410b6213ef9a9f1915009630c5c433669f85c",
      "path": "release/bootstrap-runtime-bc2da76a-20261005/QIKVRT_Bootstrap_Runtime_bc2da76a.zip.part019",
      "sha256": "8f4b60538bc92d6b7a91ce5f909caa9cbe1f0594343c45003e2069c8ff45564d"
    },
    {
      "bytes": 4194304,
      "git_blob_sha1": "d0c9fba8f80afe58f61787c33984660dbeda5e02",
      "path": "release/bootstrap-runtime-bc2da76a-20261005/QIKVRT_Bootstrap_Runtime_bc2da76a.zip.part020",
      "sha256": "0ab7099aa288e1b551c1f9190ca81cd904ce97714be2edc0e126e420b39f64a8"
    },
    {
      "bytes": 4194304,
      "git_blob_sha1": "348cbe75c34823ef0f6288af31f423a5aff01ee4",
      "path": "release/bootstrap-runtime-bc2da76a-20261005/QIKVRT_Bootstrap_Runtime_bc2da76a.zip.part021",
      "sha256": "187d5dc5ad57a71b8f47dfab15df23fa3ce20dd1fd2ce958a0644dbd5903b19c"
    },
    {
      "bytes": 4194304,
      "git_blob_sha1": "d365b204cc11f8cd921c15b59904905bffd45a08",
      "path": "release/bootstrap-runtime-bc2da76a-20261005/QIKVRT_Bootstrap_Runtime_bc2da76a.zip.part022",
      "sha256": "72fc0219b8051d8900f9627e95b71278f458be457d6945461d8d154d67565c03"
    },
    {
      "bytes": 4194304,
      "git_blob_sha1": "3d4fc22b22123d0ce05e9a2ef3953cc5becd3b0b",
      "path": "release/bootstrap-runtime-bc2da76a-20261005/QIKVRT_Bootstrap_Runtime_bc2da76a.zip.part023",
      "sha256": "a37e798582dc63ae2b7c0ea676386fae1a5aa1bce1c2f6e1fc8df1a3a29b088b"
    },
    {
      "bytes": 4194304,
      "git_blob_sha1": "c6283b3b169fa8e0d2d66ee188ae8587795ac5e9",
      "path": "release/bootstrap-runtime-bc2da76a-20261005/QIKVRT_Bootstrap_Runtime_bc2da76a.zip.part024",
      "sha256": "a163c7b2e5309a92444041a3d62520b0ca1373193eb96f772260ade8f728d253"
    },
    {
      "bytes": 4194304,
      "git_blob_sha1": "30a0dd76712b1d490b0cba7539d09455e2c4894f",
      "path": "release/bootstrap-runtime-bc2da76a-20261005/QIKVRT_Bootstrap_Runtime_bc2da76a.zip.part025",
      "sha256": "a53c85de232ba60c873efa634fb76488e7bc87c4005e4baf4cbd9d1d95bddaf2"
    },
    {
      "bytes": 4194304,
      "git_blob_sha1": "552c1bee7fe49042f48d7b29b310c974db556cfb",
      "path": "release/bootstrap-runtime-bc2da76a-20261005/QIKVRT_Bootstrap_Runtime_bc2da76a.zip.part026",
      "sha256": "b9ad6b6d6841feda4cce0285135f54a53ab319ae11eefeb9c3f5ce75eee74c95"
    },
    {
      "bytes": 4194304,
      "git_blob_sha1": "4db4b49f69edaddee8a22bf073db37edd3b9914e",
      "path": "release/bootstrap-runtime-bc2da76a-20261005/QIKVRT_Bootstrap_Runtime_bc2da76a.zip.part027",
      "sha256": "82446dad2029b15216c87a9a37a5a643082414e784ccb033bedc51557710e305"
    },
    {
      "bytes": 1333886,
      "git_blob_sha1": "0d5282ca78c8fb1a3b39b4ec66a70c1cb9ac8a6e",
      "path": "release/bootstrap-runtime-bc2da76a-20261005/QIKVRT_Bootstrap_Runtime_bc2da76a.zip.part028",
      "sha256": "3d137f1484407cb1b64f3378593207d6b5dfbf499f4ce1c0b0b58772f9185cf9"
    }
  ],
  "change_notice_path": null,
  "change_reasons": [],
  "changed_claim_ids": [],
  "content_changed": false,
  "original_files": [],
  "publication_id": "qikvrt-bootstrap-runtime-bc2da76a-20261005",
  "return": {
    "candidate_returned_to_owner": true,
    "owner_name": "Ingolf Lohmann",
    "owner_type": "NATURAL_PERSON",
    "return_channel": "This ChatGPT Work conversation: complete QIKVRT_PR464_Endartefakt_Review_83439a26.zip delivered by assistant commentary; review ZIP SHA-256 acc6cff8632757aa4b7691b70f21bd05c2c017a9908dfeaa1851cd9fe3b3bf0d; contains all 45 unmodified PR464 release files. Owner decision remains pending.",
    "returned_at": "2026-10-05T23:18:13.112850+00:00",
    "visible_change_notice_returned": false
  },
  "schema": "qikvrt_prepublication_return_receipt_v2"
}
